{
  "feature_title": "Checkout",
  "persona": "registered shopper",
  "behavior": "complete checkout with valid payment details",
  "value": "buy items without manual support",
  "feature_tags": ["checkout", "story-123"],
  "test_cases": [
    {
      "id": "CHK-001",
      "title": "Complete checkout with a valid card",
      "objective": "Verify the shopper can submit a valid order",
      "coverage": "happy path",
      "description": "Validates the standard checkout path for a logged-in shopper.",
      "preconditions": [
        "The shopper is signed in.",
        "The cart contains one in-stock item."
      ],
      "steps": [
        {
          "action": "Open the checkout page.",
          "expected_result": "The checkout summary and payment form are visible."
        },
        {
          "action": "Enter valid shipping and card details and submit the order.",
          "expected_result": "The order is accepted and a confirmation page is displayed."
        }
      ],
      "expected_outcome": "The shopper sees an order confirmation with a new order number.",
      "requirements_coverage": ["STORY-123", "REQ-CHECKOUT-01"],
      "execution_type": "Manual",
      "design_status": "Approved",
      "test_suite": "Checkout",
      "test_level": "E2E",
      "test_engineer": "QA Team",
      "notes": "Use a non-expired Visa test card."
    }
  ],
  "scenarios": [
    {
      "title": "Complete checkout with a valid card",
      "tags": ["story-123", "checkout"],
      "steps": [
        "Given the shopper is signed in",
        "And the cart contains one in-stock item",
        "When the shopper enters valid shipping and card details",
        "And submits the order",
        "Then the order is accepted",
        "And a confirmation page is displayed"
      ]
    }
  ],
  "zephyr_test_cases": [
    {
      "folder": "Checkout",
      "name": "Complete checkout with a valid card",
      "objective": "Verify the shopper can submit a valid order",
      "status": "Approved",
      "precondition": "Shopper signed in; cart has one in-stock item",
      "labels": ["checkout", "happy-path"],
      "steps": [
        {
          "step": "Open the checkout page",
          "expected_result": "The checkout summary and payment form are visible"
        },
        {
          "step": "Enter valid shipping and card details and submit the order",
          "expected_result": "The order is accepted and a confirmation page is displayed"
        }
      ],
      "execution_type": "Manual",
      "priority": "High",
      "estimated_time": "5m",
      "is_open": "Yes"
    }
  ]
}
